[{"schema":"relatte.dynamic-door-grant.experimental/v0","grant_id":"grant:5eaba06f-704d-44ab-a2c3-5ed5ab2ecd2d","world_id":"world:88a5dc9d62913f13705305796f7018129f70e2743d7bf3f0911cc413efe2c121","interface_id":"interface:808b5966","offer_id":"offer:01bfb3e5-4005-492f-985c-9fd05c56aabc","descriptor_digest":"sha256:27e710eb35fb98e461660b921ececf1c5444e54598250270045a2caaab1dacb3","subject":"visitor","operation":"observe","permission":"observe","expires_at":61000,"max_uses":1,"public_key":"MCowBQYDK2VwAyEAcQgUP18GNcgpyHbmmnlEDtrS/JitcrW/kA2Qf+NkBus=","signature":"lorPdxl+12JqOpZuVsTBsHRVT2bz6TogMe8n6BomnFQwcZ24d22zoWJC8Ke545ICA1VSCyu4rWZm1CfEEjj6DQ=="},{"schema":"relatte.dynamic-door-grant.experimental/v0","grant_id":"grant:d5089043-f3a3-47f1-aa8f-68f32196ea12","world_id":"world:218b8340514975b70f9e0f022292fcb30275e2d9aad9cea252e6fa2520fe69de","interface_id":"interface:eb1d970e-82b5-4570-acd1-bbeda03222cf","offer_id":"offer:87e5cd90-6e60-40d2-8963-b414949f0af6","descriptor_digest":"sha256:50cb95282bc630312b4798ff07faaa04c2eb78ae6add541c243835ae7ad6a06c","subject":"visitor","operation":"observe","permission":"observe","expires_at":61000,"max_uses":1,"public_key":"MCowBQYDK2VwAyEArA8WsqFg9vHa0Rcc4vtsYIjsstjxb6jYF4G6QiGI9nU=","signature":"VNOagQWWiR1tBGcHR1L7DuopWwfVPeIN1G90NoNq8PClO30qoMLlQIYiWGyPDpsZo3DnMZoWRXbCXTunE9/eBQ=="}]