[{"schema":"relatte.dynamic-door-grant.experimental/v0","grant_id":"grant:7b3b5cca-2af7-40fb-aec5-0633c9d1d19b","world_id":"world:88a5dc9d62913f13705305796f7018129f70e2743d7bf3f0911cc413efe2c121","interface_id":"interface:808b5966","offer_id":"offer:01bfb3e5-4005-492f-985c-9fd05c56aabc","descriptor_digest":"sha256:27e710eb35fb98e461660b921ececf1c5444e54598250270045a2caaab1dacb3","subject":"visitor","operation":"observe","permission":"observe","expires_at":61000,"max_uses":3,"public_key":"MCowBQYDK2VwAyEAcQgUP18GNcgpyHbmmnlEDtrS/JitcrW/kA2Qf+NkBus=","signature":"qvnmaOQA9QPixCUhnf5+r6CCnVm1YwpePVzo+BydqBKP2iLIw+PTCiYEtAbc3eAFmpX8o234YmOm1Msbds5RDQ=="},{"schema":"relatte.dynamic-door-grant.experimental/v0","grant_id":"grant:ac79648e-c5e0-43f4-8fb2-5dd7c459aae9","world_id":"world:218b8340514975b70f9e0f022292fcb30275e2d9aad9cea252e6fa2520fe69de","interface_id":"interface:552dd703-9534-4075-a884-33125591fc50","offer_id":"offer:720aa418-f84e-4b60-bc38-c3ccaaa85c28","descriptor_digest":"sha256:2002b2b22f23a33c0a52118483f81eab5f1911ec2d010abe6f090872cb4346cc","subject":"visitor","operation":"observe","permission":"observe","expires_at":61000,"max_uses":3,"public_key":"MCowBQYDK2VwAyEArA8WsqFg9vHa0Rcc4vtsYIjsstjxb6jYF4G6QiGI9nU=","signature":"ShtgX/i0Gd56I8hUWUbYHozg8fyjorwptQxv95fOcNjpVkPfz+SiHYn3dmN/7aMbT4FIyzUjstzuDbiZ50LsBA=="}]