[{"schema":"relatte.dynamic-door-grant.experimental/v0","grant_id":"grant:1b9c086c-75d7-4ff4-a0f7-f71d6a58ecbb","world_id":"world:88a5dc9d62913f13705305796f7018129f70e2743d7bf3f0911cc413efe2c121","interface_id":"interface:808b5966","offer_id":"offer:01bfb3e5-4005-492f-985c-9fd05c56aabc","descriptor_digest":"sha256:27e710eb35fb98e461660b921ececf1c5444e54598250270045a2caaab1dacb3","subject":"visitor","operation":"observe","permission":"observe","expires_at":61000,"max_uses":1,"public_key":"MCowBQYDK2VwAyEAcQgUP18GNcgpyHbmmnlEDtrS/JitcrW/kA2Qf+NkBus=","signature":"kE6Rn/4M9O+p42wrobC9JpEjXojvcjsixSaeJL0EuHMOaQvmQkX+l83Y8z9ywHq/Znt8tWcgQuaVaAI+3wjPAA=="},{"schema":"relatte.dynamic-door-grant.experimental/v0","grant_id":"grant:1f30342c-790a-4718-9f89-4098d7a7705f","world_id":"world:6506087b58a232047c933cc203523f89e59171c75add4687fccc13af703e585b","interface_id":"interface:552dd703-9534-4075-a884-33125591fc50","offer_id":"offer:1841a5ed-be19-459b-b484-5c501f2f5f97","descriptor_digest":"sha256:2002b2b22f23a33c0a52118483f81eab5f1911ec2d010abe6f090872cb4346cc","subject":"visitor","operation":"observe","permission":"observe","expires_at":61000,"max_uses":1,"public_key":"MCowBQYDK2VwAyEAGBQavc3w0tye1QLG1aPPDfsI3Mx6zyAJ3FCUspFiRN0=","signature":"BIGTwhcfFWkqT7iC9IjNRucrb+deftCzUU8nXYTMnMTzm9IP+zbH+QAC3DnCP/dI1+cfeoHZv3AdAryat9z/BQ=="}]